{
  "$schema": "https://raw.githubusercontent.com/xsyetopz/OpenJoystickDriver/main/Resources/Schemas/controller.schema.json",
  "vendorID": 7085,
  "productID": 62725,
  "protocol": {
    "family": "xbox.xusb",
    "variant": "wired"
  },
  "capabilities": {
    "absent": [
      "left-trigger",
      "right-trigger"
    ]
  }
}
