{
  "$schema": "https://raw.githubusercontent.com/xsyetopz/OpenJoystickDriver/main/Resources/Schemas/controller.schema.json",
  "vendorID": 3853,
  "productID": 99,
  "protocol": {
    "family": "xbox.gip"
  },
  "capabilities": {
    "absent": [
      "left-trigger",
      "right-trigger"
    ]
  }
}
