{
  "$schema": "https://raw.githubusercontent.com/xsyetopz/OpenJoystickDriver/main/Resources/Schemas/controller.schema.json",
  "vendorID": 3695,
  "productID": 1025,
  "protocol": {
    "family": "xbox.xusb",
    "variant": "wired"
  },
  "usb": {
    "configuration": "set1-before-claim",
    "endpoints": {
      "in": 129,
      "out": 2
    }
  }
}
