{
  "$schema": "https://raw.githubusercontent.com/xsyetopz/OpenJoystickDriver/main/Resources/Schemas/controller.schema.json",
  "vendorID": 14295,
  "productID": 10241,
  "protocol": {
    "family": "xbox.gip"
  },
  "usb": {
    "endpoints": {
      "in": 129,
      "out": 1
    },
    "configuration": "set1-before-claim",
    "postHandshakeSettleMs": 200
  }
}
