{
  "$schema": "https://raw.githubusercontent.com/xsyetopz/OpenJoystickDriver/main/Resources/Schemas/controller.schema.json",
  "vendorID": 1356,
  "productID": 3570,
  "protocol": {
    "family": "sony.dualsense"
  },
  "capabilities": {
    "present": [
      "paddle-left-1",
      "paddle-right-1",
      "auxiliary-1",
      "auxiliary-2"
    ]
  }
}
