{
  "$schema": "https://raw.githubusercontent.com/xsyetopz/OpenJoystickDriver/main/Resources/Schemas/controller.schema.json",
  "vendorID": 1133,
  "productID": 49693,
  "protocol": {
    "family": "xbox.xusb",
    "variant": "wired"
  },
  "usb": {
    "endpoints": {
      "in": 129,
      "out": 2
    }
  }
}
